{
  "schema_version": "1.0.0",
  "kind": "module3_matching_input_v1",
  "module3_input": {
    "schema_version": "1.0.0",
    "benchmark_id": "module3_NO_spectrum0",
    "module2_input": {
      "schema_version": "1.0.0",
      "benchmark_id": "module3_NO_spectrum0",
      "mode": "inverse",
      "ordering": "NO",
      "scalar": {
        "kind": "module1_input",
        "record": {
          "schema_version": "1.0.0",
          "benchmark_id": "module3_NO_spectrum0",
          "model": "ZeeTypeII_Module0_v1_restricted_CP",
          "parameter_convention": "SARAH_ZeeTypeII_Florentino_v1",
          "units": {
            "masses": "GeV",
            "angles": "rad",
            "mass_squared": "GeV^2",
            "quartics": "1"
          },
          "physical": {
            "mh1": 125.0,
            "mh2": 580.7,
            "ma": 633.7,
            "mH1": 300.0,
            "mH2": 700.0,
            "alpha": 1.398,
            "beta": 1.394,
            "gamma": 1.089,
            "m12sq": 57700.0,
            "lc": 4.473,
            "k1": 1.082,
            "k2": 0.00398,
            "k12": -0.001266,
            "v": 246.21965
          },
          "electroweak": {
            "mW": 80.379,
            "mZ": 91.1876,
            "SM_reference_mh": 125.0,
            "scheme": "on_shell_MW_MZ"
          },
          "ew_fit": "Gfitter_2026_U_floating",
          "search": {
            "starts": 64,
            "seeds": [
              123,
              104852
            ]
          }
        },
        "sha256": "4ee55ddb553124a910ff4fc871a4110cb9ea2c9c24b705d52d6d3f87516e3f15"
      },
      "lepton_masses_GeV": [
        0.00051099895,
        0.1056583755,
        1.77686
      ],
      "target_eV": {
        "real": [
          [
            0.0037835351327915583,
            -0.0010952870162632181,
            -0.004418020497932156
          ],
          [
            -0.0010952870162632181,
            -0.011963878129116574,
            -0.014795229184407262
          ],
          [
            -0.004418020497932156,
            -0.01479522918440726,
            -0.00803541038399494
          ]
        ],
        "imag": [
          [
            -0.0016666238981127184,
            0.0027186729591286186,
            0.005823088559289724
          ],
          [
            0.002718672959128619,
            -0.026093427300150792,
            -0.019116480919979674
          ],
          [
            0.005823088559289724,
            -0.019116480919979674,
            -0.020335303689073325
          ]
        ]
      },
      "null_cone": {
        "t": {
          "real": 0.25,
          "imag": 0.1
        },
        "scale": 0.002,
        "root": 0,
        "chart": [
          0,
          1,
          2
        ],
        "phase_rad": 0.43
      },
      "homogeneous_coefficients": {
        "real": [
          1e-07,
          -2e-07,
          3e-07,
          1e-07
        ],
        "imag": [
          2e-07,
          0,
          -1e-07,
          3e-07
        ]
      }
    },
    "constants": {
      "alpha_em": 0.0072973525692838015,
      "GF_GeV_minus2": 1.1663787e-05,
      "total_lepton_widths_GeV": [
        2.995983701908041e-19,
        2.267350867723045e-12
      ],
      "source": {
        "version": "Explicit illustrative normalization snapshot (not a likelihood)",
        "url": "https://pdg.lbl.gov/2024/reviews/rpp2024-rev-phys-constants.pdf",
        "selection": "alpha(0), GF, hbar; mu and tau lifetime normalizations supplied explicitly; no LFV limits"
      }
    },
    "numerics": {
      "tree_quadrature_order": 24,
      "tree_relative_tolerance": 2e-05
    }
  },
  "module2_output": {
    "schema_version": "1.0.0",
    "benchmark_id": "module3_NO_spectrum0",
    "status": "NEUTRINO_COMPUTED",
    "global_zee_acceptance": null,
    "gates": {
      "forward": "PASS",
      "inverse": "PASS",
      "observables": "PASS",
      "data_comparison": "NOT_EVALUATED",
      "lfv": "NOT_EVALUATED",
      "global_vacuum": "NOT_EVALUATED",
      "rg_closure": "NOT_EVALUATED"
    },
    "units": {
      "Mnu": "eV",
      "Yukawas": "1",
      "angles": "rad"
    },
    "Mnu": {
      "real": [
        [
          0.003783535132791547,
          -0.0010952870162632172,
          -0.004418020497932142
        ],
        [
          -0.0010952870162632172,
          -0.011963878129116683,
          -0.014795229184407226
        ],
        [
          -0.004418020497932142,
          -0.014795229184407226,
          -0.008035410383994935
        ]
      ],
      "imag": [
        [
          -0.001666623898112722,
          0.0027186729591286186,
          0.005823088559289728
        ],
        [
          0.0027186729591286186,
          -0.026093427300150716,
          -0.019116480919979636
        ],
        [
          0.005823088559289728,
          -0.019116480919979636,
          -0.020335303689073315
        ]
      ]
    },
    "F": {
      "real": [
        [
          0.0,
          0.00037110871435160037,
          -0.0001492011642252908
        ],
        [
          -0.00037110871435160037,
          0.0,
          0.0018179314993497701
        ],
        [
          0.0001492011642252908,
          -0.0018179314993497701,
          0.0
        ]
      ],
      "imag": [
        [
          0.0,
          0.00039022855114958247,
          0.00022044708519790567
        ],
        [
          -0.00039022855114958247,
          0.0,
          0.0008337416048584215
        ],
        [
          -0.00022044708519790567,
          -0.0008337416048584215,
          0.0
        ]
      ]
    },
    "D": {
      "real": [
        [
          1.4146442239076168e-07,
          9.988164419157512e-08,
          -2.4270970143882104e-07
        ],
        [
          -5.02920303549246e-06,
          -1.2862043795506866e-06,
          -8.474086135532208e-06
        ],
        [
          1.0236048816821419e-07,
          6.946666040384624e-07,
          1.2914271122724957e-06
        ]
      ],
      "imag": [
        [
          1.7010879607956144e-07,
          1.8771853357193572e-07,
          -2.3493104208937388e-07
        ],
        [
          7.377026257690367e-06,
          -2.8415455142979305e-07,
          -8.126504593576614e-06
        ],
        [
          -2.532322496413992e-07,
          5.981825823001321e-07,
          6.989715673989236e-07
        ]
      ]
    },
    "Ye": {
      "real": [
        [
          3.769439287646796e-07,
          -9.832470861960679e-08,
          2.3892638999165335e-07
        ],
        [
          4.9508088003155645e-06,
          0.00010800061109655065,
          8.341993735060425e-06
        ],
        [
          -1.0076491286022803e-07,
          -6.83838276619147e-07,
          0.0017936851777034303
        ]
      ],
      "imag": [
        [
          -1.674571733728608e-07,
          -1.8479241371476448e-07,
          2.3126898286568934e-07
        ],
        [
          -7.262034612439584e-06,
          2.7972520575132987e-07,
          7.999830226330158e-06
        ],
        [
          2.4928491476693466e-07,
          -5.888582289772269e-07,
          -6.880761350511084e-07
        ]
      ]
    },
    "Ye2": {
      "real": [
        [
          2.9141579728629216e-06,
          1.7566858605961278e-08,
          -4.2686992609904176e-08
        ],
        [
          -8.845198668908103e-07,
          0.0005971847695667057,
          -1.4903946982701703e-06
        ],
        [
          1.8002829619417325e-08,
          1.22175702154253e-07,
          0.010046905156761059
        ]
      ],
      "imag": [
        [
          2.991818158928558e-08,
          3.3015324924484375e-08,
          -4.131890731213329e-08
        ],
        [
          1.297447376344263e-06,
          -4.997617798154518e-08,
          -1.4292631875607085e-06
        ],
        [
          -4.453766415165973e-08,
          1.0520640633087983e-07,
          1.2293284510348217e-07
        ]
      ]
    },
    "inverse": {
      "D0": {
        "real": [
          [
            5.226913816660366e-09,
            -2.8727059775133294e-10,
            -4.3772217101889225e-09
          ],
          [
            -4.998602189589563e-06,
            -1.158019028420283e-06,
            -8.473907813164593e-06
          ],
          [
            9.892893071149273e-08,
            6.9466477834176e-07,
            1.2990686228342754e-06
          ]
        ],
        "imag": [
          [
            2.4124116128716517e-09,
            7.692924746227639e-10,
            6.22791756799336e-09
          ],
          [
            7.399523668881129e-06,
            -5.394781466896469e-07,
            -8.126630427395852e-06
          ],
          [
            -2.502144652079664e-07,
            5.98166257896984e-07,
            6.838081929823317e-07
          ]
        ]
      },
      "homogeneous": {
        "real": [
          [
            [
              0.7547370616031515,
              0.4585770526513867,
              0.0823309045953604
            ],
            [
              -0.00018374770409729235,
              0.03550490446353953,
              -3.3715906589813256e-06
            ],
            [
              -0.0004999232157493483,
              4.3954198007054024e-05,
              0.0021295951982776315
            ]
          ],
          [
            [
              -0.16558026764972075,
              -0.33884821659257713,
              0.20491765785604252
            ],
            [
              -0.0067272951725458816,
              0.7200233913656098,
              -5.371796482099697e-05
            ],
            [
              -0.011130910698280705,
              -1.3489117616560797e-05,
              0.0428568042440371
            ]
          ],
          [
            [
              -0.07864357526368694,
              -0.2534424317372894,
              -0.5573769020483214
            ],
            [